[
    {
        "name": "미디어센터",
        "keyword": "mediacenter",
        "title": "🙌🏻성공회대학교 공식 언론기관 '미디어센터'에서 2026학년도 1학기 정규 수습기자를 모집합니다!🙌🏻",
        "category": "언론",
        "deadline": "2026-03-13",
        "description": "학보 발행 및 영상 뉴스 제작을 통해 대학 사회를 기록하고 언론 실무 역량을 키우는 학교 공식 언론기관",
        "tags": [
            "언론고시",
            "기사작성",
            "영상제작",
            "장학금혜택",
            "실무경험",
            "공식기구"
        ]
    },
    {
        "name": "Read-dom",
        "keyword": "readdom",
        "title": "대학연합 \"자유\"탐구를 추구하는 독서 동아리 <Read-dom>에서 부원을 모집해요",
        "category": "학술",
        "deadline": "2026-03-15",
        "description": "수준별 커리큘럼을 통해 가벼운 독서 나눔부터 심화 토론까지 함께 즐기는 수도권 대학연합 독서 동아리",
        "tags": [
            "독서모임",
            "연합동아리",
            "독서토론",
            "문학기행",
            "수도권대학",
            "심화탐구"
        ]
    },
    {
        "name": "아침햇살",
        "keyword": "achimhaessal",
        "title": "☀️ 성공회대학교 중앙율동패 아침햇살 32기 신입부원 모집 ☀️",
        "category": "연극",
        "deadline": "",
        "description": "민중가요에 맞춘 몸짓과 율동으로 학교 행사 및 인권·연대 무대에서 공연하는 성공회대학교 중앙동아리",
        "tags": [
            "중앙동아리",
            "율동패",
            "공연예술",
            "민중가요",
            "인권연대",
            "신입모집"
        ]
    },
    {
        "name": "엘피스 (ELPIS)",
        "keyword": "elpis",
        "title": "🔥ELPIS 40기를 모집합니다🔥",
        "category": "밴드",
        "deadline": "2026-03-08",
        "description": "1987년부터 이어진 전통 있는 락 밴드 동아리로, 다양한 락 장르 연주와 정기 공연을 진행",
        "tags": [
            "중앙동아리",
            "락밴드",
            "전통있는",
            "정기공연",
            "장비완비",
            "신입모집"
        ]
    },
    {
        "name": "산:들",
        "keyword": "sandeul",
        "title": "⛰️등산 동아리 “산:들” 신입부원 리크루팅🌿",
        "category": "운동",
        "deadline": "2026-03-13",
        "description": "초보자도 부담 없이 참여할 수 있는 체계적인 난이도별 산행과 맛집 탐방을 병행하는 서울권 대학생 연합 등산 동아리",
        "tags": [
            "등산",
            "연합동아리",
            "건강관리",
            "힐링",
            "맛집탐방",
            "친목도모"
        ]
    },
    {
        "name": "열음",
        "keyword": "yeoleum",
        "title": "[모집] 너 페미야? 물론이다.",
        "category": "인권",
        "deadline": "2026-03-13",
        "description": "교차성 페미니즘을 기반으로 학내 담론 형성, 세미나, 연대 활동을 실천하는 여성학 학회",
        "tags": [
            "페미니즘",
            "여성학",
            "학내담론",
            "정기세미나",
            "인권연대",
            "사회참여"
        ]
    },
    {
        "name": "청춘탐독 3기",
        "keyword": "cheongchuntamdog",
        "title": "❤️대학생연합독서동아리 <청춘탐독 3기> 회원모집❤️",
        "category": "학술",
        "deadline": "2026-04-04",
        "description": "1년에 12권 완독을 목표로 다양한 사회적 주제의 도서를 함께 읽고 공유하는 연합 독서 동아리",
        "tags": [
            "독서",
            "연합동아리",
            "서울지역",
            "신입생환영",
            "인문학",
            "완독챌린지"
        ]
    },
    {
        "name": "책물결",
        "keyword": "chaegmulgyeol",
        "title": "📚 2026 - 1학기 개강맞이 대학연합책동아리《책물결》신입회원 모집",
        "category": "학술",
        "deadline": "2026-03-15",
        "description": "주 1회 정기 독서토론과 문학관 답사, 필사 등 다양한 독서 활동을 함께하는 대학 연합 동아리",
        "tags": [
            "독서토론",
            "연합동아리",
            "서울권",
            "정기모임",
            "문학답사",
            "신입회원모집"
        ]
    },
    {
        "name": "콕 (COCK)",
        "keyword": "cock",
        "title": "🏸성공회대 배드민턴 동아리 콕 신입 부원 모집 안내🏸",
        "category": "운동",
        "deadline": "",
        "description": "실력 상관없이 배드민턴을 즐기고 싶은 성공회대 학생들을 위한 상시 모집 운동 동아리",
        "tags": [
            "배드민턴",
            "성공회대학교",
            "스포츠",
            "상시모집",
            "친목",
            "정기운동"
        ]
    },
    {
        "name": "퍼즐 (PUZZLE)",
        "keyword": "puzzle",
        "title": "🧩 퍼즐 11기 모집 시작!",
        "category": "문화 기획",
        "deadline": "2026-03-08",
        "description": "공연의 기획부터 준비, 운영까지 직접 참여하며 하나의 무대를 함께 완성해가는 문화기획 동아리",
        "tags": [
            "문화기획",
            "공연기획",
            "무대제작",
            "성공회대학교",
            "신입부원모집",
            "이벤트운영"
        ]
    },
    {
        "name": "낯가림 구조대",
        "keyword": "nachgalimgujodae",
        "title": "🚨 [ 낯가림 구조대 | 내향인 대학생활 생존 연습 ] 🚑",
        "category": "친목",
        "deadline": "",
        "description": "내향적인 대학생들이 모여 발표 불안이나 소통의 어려움을 공유하고 소소한 생존 팁을 나누는 내향인 전용 모임",
        "tags": [
            "내향인",
            "대학생활",
            "발표불안",
            "힐링",
            "소통팁",
            "친목모임"
        ]
    },
    {
        "name": "푸름",
        "keyword": "puleum",
        "title": "[대학연합] 환경동아리 푸름 11기 신입부원 모집🌿",
        "category": "봉사",
        "deadline": "2026-03-08",
        "description": "환경 세미나, 플로깅, 나무 심기 등 다양한 실천을 통해 환경 보호를 실천하는 대학 연합 동아리",
        "tags": [
            "환경보호",
            "플로깅",
            "연합동아리",
            "세미나",
            "봉사활동",
            "환경답사"
        ]
    },
    {
        "name": "구장밖구장",
        "keyword": "gujangbakkgujang",
        "title": "⚾️야구 직관 연합 동아리 [구장밖구장] 신입 부원 모집",
        "category": "운동",
        "deadline": "2026-03-13",
        "description": "야구 경기 직관부터 전국 구장 원정 투어, 캐치볼 등 야구를 매개로 다양한 활동을 즐기는 수도권 연합 동아리",
        "tags": [
            "야구직관",
            "연합동아리",
            "KBO",
            "스포츠관람",
            "친목",
            "수도권대학생"
        ]
    },
    {
        "name": "S.OWL",
        "keyword": "sowl",
        "title": "[마감 D-5] 🦉성공회대 IT 정동아리 S.OWL 모집",
        "category": "개발자",
        "deadline": "2026-03-08",
        "description": "24시간 동아리방 운영과 학습 지원을 통해 자율적으로 프로젝트와 스터디를 진행하는 성공회대 IT 개발 정동아리",
        "tags": [
            "IT개발",
            "성공회대학교",
            "소프트웨어",
            "해커톤",
            "스터디",
            "비전공자환영"
        ]
    },
    {
        "name": "멋쟁이사자처럼 (LikeLion) SKHU",
        "keyword": "likelion",
        "title": "🦁 LikeLion SKHU 14기 서류 마감 D-3 🦁",
        "category": "개발자",
        "deadline": "2026-03-06",
        "description": "체계적인 커리큘럼과 해커톤을 통해 아이디어를 실제 서비스로 구현하는 성공회대 IT 서비스 빌딩 동아리",
        "tags": [
            "웹개발",
            "성공회대학교",
            "해커톤",
            "아이디어톤",
            "연합동아리",
            "프로젝트"
        ]
    },
    {
        "name": "파-란",
        "keyword": "palan",
        "title": "❗️마감임박❗️노래 같이 부를 신입단원을 찾습니다🔍",
        "category": "음악",
        "deadline": "",
        "description": "기초 발성 훈련부터 정기 공연 및 버스킹까지, 노래를 통해 교감하고 무대 경험을 쌓는 서울 지역 노래 동아리",
        "tags": [
            "보컬",
            "버스킹",
            "정기공연",
            "발성훈련",
            "서울지역",
            "음악동아리"
        ]
    },
    {
        "name": "우마이 갓",
        "keyword": "umaigod",
        "title": "🍱 \"우마이 갓\" 일식 맛집 동아리 (3기 모집) 🍱",
        "category": "친목",
        "deadline": "2026-03-13",
        "description": "일식을 사랑하는 사람들이 모여 현지 느낌의 맛집을 탐방하고 일식 매거진을 운영하는 소규모 맛집 동아리",
        "tags": [
            "일식탐방",
            "맛집지도",
            "소규모모임",
            "미식",
            "인스타그램",
            "친목"
        ]
    },
    {
        "name": "보스턴 (Bosturn)",
        "keyword": "bosturn",
        "title": "🎲 연합 보드게임 동아리 보스턴 9기 모집 🎲",
        "category": "친목",
        "deadline": "",
        "description": "면접 없이 가입과 탈퇴가 자유로우며, 제휴 보드게임 카페 할인 혜택과 함께 다양한 보드게임을 즐기는 대학 연합 동아리",
        "tags": [
            "보드게임",
            "연합동아리",
            "상시모집",
            "무면접",
            "대학생",
            "취미공유"
        ]
    },
    {
        "name": "동화",
        "keyword": "donghwa",
        "title": "🌸새학기 그냥 보내긴 아깝지 않아?🌸 버킷리스트 연합 동아리 🌺동화🌺에서 18기 신입 부원을 모집합니다.",
        "category": "친목",
        "deadline": "2026-03-09",
        "description": "하고 싶었던 버킷리스트를 함께 실현하며 소그룹 활동과 정기 모임을 통해 친목을 다지는 전국 연합 동아리",
        "tags": [
            "버킷리스트",
            "연합동아리",
            "친목",
            "엠티",
            "소그룹",
            "번개모임"
        ]
    },
    {
        "name": "Clutch",
        "keyword": "clutch",
        "title": "🎲전략보드게임 친목동아리Clutch 신규 멤버 모집 🎲",
        "category": "친목",
        "deadline": "",
        "description": "서울 2호선 라인을 중심으로 전략 및 파티 보드게임을 즐기며 방탈출, 피크닉 등 다양한 번개 모임을 병행하는 수도권 청년 커뮤니티",
        "tags": [
            "보드게임",
            "수도권",
            "전략게임",
            "친목",
            "번개모임",
            "초보환영"
        ]
    },
    {
        "name": "해피트레이드 (HAPPY TRADE)",
        "keyword": "happytrade",
        "title": "[모집] 공정무역 동아리 해피트레이드🍌",
        "category": "학술",
        "deadline": "",
        "description": "공정무역의 가치를 알리기 위해 해외 대학 교류, 굿즈 기획, 캠페인 운영 등 다양한 프로젝트를 수행하는 성공회대 동아리",
        "tags": [
            "공정무역",
            "성공회대학교",
            "해외교류",
            "캠페인",
            "창업",
            "가치소비"
        ]
    },
    {
        "name": "대학생기후행동",
        "keyword": "daehagsaeng-gihuhaengdong",
        "title": "🌍기후환경 동아리 “대학생기후행동” 6기 신입회원 모집🌍",
        "category": "봉사",
        "deadline": "2026-03-15",
        "description": "캠퍼스 탄소중립 캠페인, 정책 제안, 세미나 등 기후 위기 해결을 위해 직접 행동하고 실천하는 전국 연합 환경 동아리",
        "tags": [
            "기후위기",
            "환경보호",
            "탄소중립",
            "연합동아리",
            "정책제안",
            "캠페인"
        ]
    },
    {
        "name": "어디든",
        "keyword": "eodideun",
        "title": "🚏 \"어디든\" 동아리~ 5기 추가 모집",
        "category": "친목",
        "deadline": "",
        "description": "서울 2호선 라인을 중심으로 골목 탐방, 맛집 투어, 축제 참여 등 새로운 장소를 함께 여행하며 친목을 다지는 연합 동아리",
        "tags": [
            "서울탐방",
            "맛집투어",
            "연합동아리",
            "기후동행카드",
            "골목여행",
            "친목"
        ]
    },
    {
        "name": "화랑 (HWARANG)",
        "keyword": "hwarang",
        "title": "💃성공회대 댄스동아리 화랑 신입부원 모집🕺",
        "category": "음악",
        "deadline": "2026-03-31",
        "description": "K-POP 커버와 퍼포먼스 영상 촬영, 교내 축제 공연을 진행하며 댄스팀과 기획팀이 협업하는 성공회대 댄스 동아리",
        "tags": [
            "댄스",
            "성공회대학교",
            "K-POP",
            "커버댄스",
            "영상편집",
            "공연예술"
        ]
    },
    {
        "name": "Film Clubb",
        "keyword": "filmclubb",